{
  "$schema": "../schema/gruppe.schema.json",
  "id": "schreiben",
  "titel": "Schreiben",
  "praefix": "S",
  "geltung": "Gilt für jeden Text, den Menschen lesen: UI-Texte in beiden Sprachen, Nutzungsbeschreibungen der Berechtigungen, Fehlermeldungen, Hinweise, Texte, die die App mit lokaler KI in eigener Stimme schreibt, Doku, Code-Kommentare und Commit-Nachrichten. Verbotene Wörter und Zeichen stehen in Dokumenten, die eine Regel erklären, nur in Code-Formatierung.",
  "regeln": [
    {
      "id": "S-01",
      "schluessel": "mittelpunkt",
      "text": "Kein Mittelpunkt (`·`, U+00B7) und kein verwandter Punkt (`•`, `⋅`) als Trenner. Stattdessen eine eigene Zeile, Abstand im Layout, ein Komma oder ein Satz.",
      "pakete": ["zeichen"],
      "durchsetzung": [
        "make check-texts",
        "scripts/hooks/commit-msg"
      ],
      "ki": true
    },
    {
      "id": "S-02",
      "schluessel": "gedankenstrich",
      "text": "Keine Gedankenstriche zwischen Satzteilen (`—`, ` – `, ` - `, `--`). Der Halbgeviertstrich steht nur für Bereiche wie `2023–2026` oder `10–20 %`.",
      "pakete": ["zeichen"],
      "durchsetzung": ["make check-texts", "scripts/hooks/commit-msg"],
      "ki": true
    },
    {
      "id": "S-03",
      "schluessel": "zeichen-schmuck",
      "text": "Keine Emojis, keine Deko-Pfeile (`→`, `->`, `=>`), keine Glyphen statt Symbolen (`▲`, `‹`, `✓`, `★`) und keine Ausrufezeichen. Symbole kommen aus SF Symbols über `Image(systemName:)`. Die Zeichen der Mac-Tasten sind erlaubt (`⌘ ⌥ ⌃ ⇧ ⇥ ⇤ ⇪ ⏎ ↩ ⌤ ⌫ ⌦ ⎋ ⇞ ⇟ ↖ ↘`, `🌐` vor einer Taste wie `🌐E`), Pfeiltasten nach einer Modifikatortaste (`⌘←`), als Paar (`↑/↓`, `↑ oder ↓`, `← and →`) und mit dem Wort Taste oder key (`↓-Taste`).",
      "pakete": ["zeichen"],
      "durchsetzung": ["make check-texts", "scripts/hooks/commit-msg"],
      "ki": true
    },
    {
      "id": "S-04",
      "schluessel": "floskeln",
      "text": "Keine Floskeln und Schmuckwörter, weder deutsch (`nahtlos`, `mühelos`, `revolutionär`, `innovativ`, `leistungsstark`, `smart`, `intelligent` als Schmuck, `Entdecke`, `Tauche ein`, `auf einen Blick`, `Magie`, `Reise`, `Lass uns`, `Willkommen bei`, `Mehr erfahren`, `Los geht’s`) noch englisch (`seamless`, `effortless`, `leverage`, `unlock`, `elevate`, `empower`, `delve`, `robust`, `cutting-edge`, `game-changer`, `revolutionize`, `supercharge`, `harness`, `streamline`, `in today’s …`, `whether you’re …`, `dive into`, `Let’s`, `Oops`). Stattdessen sagt der Text konkret, was passiert.",
      "pakete": ["floskeln", "floskeln-en"],
      "durchsetzung": ["make check-texts", "scripts/hooks/commit-msg (englische Liste)"],
      "ki": true
    },
    {
      "id": "S-05",
      "schluessel": "anrede",
      "text": "Deutsche Texte nutzen genau eine Anrede: die aus `starter.json` (`texts.anrede`), Standard `du` wie bei Apple und VoiceBud, sonst `Sie`. Die andere Form ist ein Fehler. Die Texte des Kits sind in der du-Form geschrieben; wer `sie` wählt, schreibt die deutschen Texte der `*Text.swift`-Dateien und der `App/Resources/InfoPlist.json` um (gemeinsame Pfade, die ein Projekt ändern darf), `make check-texts` listet jede Stelle. Knöpfe und Menübefehle stehen im Infinitiv (`Einstellungen öffnen`, `Freigabe erteilen`), englische im Imperativ (`Open Settings`).",
      "pakete": ["anrede"],
      "durchsetzung": ["make check-texts", "Review (pruefer-laie-ux)"],
      "ki": true
    },
    {
      "id": "S-06",
      "schluessel": "neutral",
      "text": "Neutral beschreiben statt werben oder versprechen: keine Superlative und Versprechen (`die beste`, `perfekt`, `garantiert`, `the best`, `perfect`, `ultimate`), keine Wertung ohne Maßstab. Fachliche Neutralitätsregeln eines Projekts kommen als eigenes Sprachpaket in `rules/projekt/pakete/` dazu.",
      "pakete": ["neutral", "neutral-en"],
      "durchsetzung": ["make check-texts", "Review"],
      "ki": true
    },
    {
      "id": "S-07",
      "schluessel": "konkret",
      "text": "Kurz und konkret: ein Gedanke je Satz, eine Zahl mit Einheit statt eines Adjektivs, der Grund einer Bitte steht dabei (`Das Mikrofon läuft nur, während du aufnimmst`). Jede Zeile muss sich rechtfertigen, jeder Hinweis steht einmal je Ansicht, Fachbegriffe bekommen einen erklärenden Satz in der Fußnote oder eine Ebene tiefer.",
      "pakete": [],
      "durchsetzung": ["Review (pruefer-laie-ux)"],
      "ki": true
    },
    {
      "id": "S-08",
      "schluessel": "fehlende-werte",
      "text": "Ein fehlender Wert wird mit seinem Grund benannt (`noch kein Lauf`, `nicht verfügbar, Modell fehlt`), nie als 0, nie als Abkürzung (`n. v.`, `N/A`), nie als Strich und nie als leere Zeile.",
      "pakete": ["fehlende-werte"],
      "durchsetzung": ["make check-texts", "Review"],
      "ki": true
    },
    {
      "id": "S-09",
      "schluessel": "platzhalter",
      "text": "Kein Blindtext und keine offenen Merkzettel (`TODO`, `FIXME`, `Lorem ipsum`) in Texten und Kommentaren. Offene Punkte stehen in der Statusdatei oder in `docs/PROJECT.md`.",
      "pakete": ["platzhalter"],
      "durchsetzung": ["make check-texts", "scripts/hooks/commit-msg"],
      "ki": true
    },
    {
      "id": "S-10",
      "schluessel": "zwei-sprachen",
      "text": "Jeder UI-Text steht in beiden Sprachen als `tr(en: \"…\", de: \"…\")` in einer Datei `*Text.swift` (`enum <Bereich>Text`), nie als Literal in einer Ansicht (`Text(\"…\")`, `Button(\"…\")`, `.help(\"…\")`, `NSMenuItem(title: \"…\")`). Einsetzungen und Mehrzahl sind `static func`. Beide Texte tragen dieselben Einsetzungen und dasselbe Auslassungszeichen; im englischen Text steht kein Deutsch, im deutschen kein Englisch. `Text(verbatim:)` mit Literal nur mit Kommentar `// verbatim: Grund`, eine begründete Ausnahme einer Sprachregel mit `// text-ausnahme: Grund`. Nutzungsbeschreibungen der Berechtigungen stehen zweisprachig in `App/Resources/InfoPlist.json`.",
      "pakete": ["englisch", "deutsch"],
      "durchsetzung": [
        "make check-texts (Literale in Ansichten, beide Sprachen, Einsetzungen, Auslassungszeichen)",
        "Selbsttest und Renders in en und de"
      ],
      "ki": false
    },
    {
      "id": "S-11",
      "schluessel": "typografie",
      "text": "Auslassungszeichen `…` statt drei Punkten; ein Menübefehl, der einen Dialog öffnet, endet damit, englisch direkt angehängt (`Settings…`), deutsch mit Leerzeichen wie bei Apple (`Einstellungen …`). Deutsche Anführungszeichen `„…“`, englische `“…”`. Keine Verkürzungen mit Apostroph im Deutschen (`geht’s`, `gibt’s`). Zahlen, Daten, Dauern und Größen nur über `Format` und `ByteText` in der UI-Sprache, Einheit mit schmalem geschütztem Leerzeichen.",
      "pakete": ["floskeln", "zeichen"],
      "durchsetzung": ["make check-texts"],
      "ki": true
    },
    {
      "id": "S-12",
      "schluessel": "kommentare",
      "text": "Code-Kommentare sind englisch und nennen den Grund selbst, ohne Verweise auf Bauplan, Stränge, Statusberichte, Vorgaben-Nummern oder Personen. Standardmäßig gibt es keinen Kommentar; einer steht nur für einen nicht offensichtlichen Grund. Kein auskommentierter Code, keine Abschnittsbanner außer `// MARK:`.",
      "pakete": ["kommentare"],
      "durchsetzung": ["make check-texts (Kommentare in Swift und Python)", "Review"],
      "ki": false
    },
    {
      "id": "S-13",
      "schluessel": "sprache",
      "text": "Die App spricht Englisch und Deutsch (`Localizer`, live umschaltbar). Doku, `CLAUDE.md`, Skills, Agenten und Statusdateien sind deutsch; Bezeichner, Code-Kommentare und Commit-Nachrichten englisch. Schlüssel der Einstellungs- und Regeldateien (`starter.json`, `starter.manifest.json`, `rules/`) und die Schalter der Skripte (`--pruefen`) sind deutsch oder englisch, wie sie sind; Code übernimmt sie unverändert.",
      "pakete": [],
      "durchsetzung": ["Review", "scripts/hooks/commit-msg (Format)"],
      "ki": false
    },
    {
      "id": "S-14",
      "schluessel": "zeitwoerter",
      "text": "Zeitangaben kommen aus Daten und `Format`, nie als fester Text: relative Zeiten (`vor 5 Minuten`) erzeugt `RelativeDateTimeFormatter` oder `Format`, nicht ein Literal. Projekte mit Datenständen schalten das Paket `zeitwoerter` in `starter.json` unter `texts.zusatzpakete` ein.",
      "pakete": ["zeitwoerter"],
      "durchsetzung": ["make check-texts (mit Paket zeitwoerter)", "Review"],
      "ki": true
    }
  ]
}
