{
  "$schema": "../schema/gruppe.schema.json",
  "id": "design",
  "titel": "Design",
  "praefix": "D",
  "geltung": "Gilt für jede Oberfläche unter `App/Sources`: Fenster, Einstellungsbereiche, Onboarding-Schritte, Insel und Kapsel, Menüleisten-Panel, Menüs, und für Icon und DMG unter `tools/`. Maße, Muster und Beispiele stehen in `docs/DESIGN.md`; Vorbild ist VoiceBud auf macOS 26.",
  "regeln": [
    {
      "id": "D-01",
      "schluessel": "tokens",
      "text": "Farben, Abstände, Radien, Schriftgrade und Federn kommen nur aus `App/Sources/Kit/Design` (`Theme`, `Space`, `Radius`, `TypeScale`, `Motion`, `Metrics`, `IslandPalette`). Farben entstehen aus dem SwiftUI-`ColorScheme` über `Theme(scheme)`, nie aus dynamischem `NSColor` oder Systemfarben wie `.secondary`, damit Renders ohne Fenster genau wie das Fenster aussehen. Ein fehlender Wert wird ein neues Token in `Kit/Design` (mit Kontrasttest), keine Zahl in der Ansicht; eine begründete Ausnahme trägt `// design-ausnahme: Grund`.",
      "pakete": ["gestaltung"],
      "durchsetzung": ["make check-design", "App/Tests/DesignTests.swift (Kontraste)"],
      "ki": false
    },
    {
      "id": "D-02",
      "schluessel": "raster",
      "text": "Abstände folgen dem Raster 8, 12, 16, 24, 32 (`Space.xs` bis `Space.xl`), 4 und 2 nur zum Feinausgleich; Zeilen sind 44 pt hoch. Ecken sind kontinuierlich (`style: .continuous`) mit Radien aus `Radius`, Linien Haarlinien von 0,5 pt.",
      "pakete": ["gestaltung"],
      "durchsetzung": ["make check-design", "Review (pruefer-design)"],
      "ki": false
    },
    {
      "id": "D-03",
      "schluessel": "typografie",
      "text": "Nur die Systemschrift (SF Pro) in den Graden von `TypeScale`, keine eigene Schrift und keine freie Größe. Zahlen, die sich ändern, mit `.monospacedDigit()`. Kleinster Grad für Text ist `TypeScale.caption` (11 pt), `micro` nur in Insel und Kapsel.",
      "pakete": ["gestaltung"],
      "durchsetzung": ["make check-design", "Review (pruefer-design)"],
      "ki": false
    },
    {
      "id": "D-04",
      "schluessel": "symbole",
      "text": "Symbole nur aus SF Symbols über `Image(systemName:)`, keine Bild-Assets für Icons, keine Emojis, keine Glyphen als Icons. Das App-Icon entsteht im Code (`make icon`). Icon-Knöpfe tragen ein `.accessibilityLabel` aus einer `*Text.swift`-Datei.",
      "pakete": ["zeichen"],
      "durchsetzung": ["make check-texts (Emoji, Glyphen)", "Selbsttest kit.symbol", "Review"],
      "ki": false
    },
    {
      "id": "D-05",
      "schluessel": "muster",
      "text": "Ein Onboarding-Schritt beginnt mit `OnboardingPage`, ein Einstellungsbereich mit `PaneScaffold`; Gruppen sind `SettingsSection`, Zeilen die Muster aus `Kit/Design/Patterns` (`ToggleRow`, `PickerRow`, `ValueRow`, `ButtonRow`, `ProgressRow`, `ListCard`). Eigene Layouts nur, wo kein Muster passt; ein allgemein nützliches wird als Kandidat für `Kit/Design` gemeldet.",
      "pakete": [],
      "durchsetzung": ["Review (pruefer-design)", "Galerie"],
      "ki": false
    },
    {
      "id": "D-06",
      "schluessel": "eine-hauptaktion",
      "text": "Jede Ansicht ist in fünf Sekunden verständlich: der Titel nennt sie, die Unterzeile sagt mit einem kurzen Satz oder einer Zahl, was hier passiert, und es gibt genau eine Hauptaktion (`.buttonStyle(.primary)`). Hält ein Statusfeld die Aktion, ist `Weiter` nicht primär. Fachliches liegt eine Ebene tiefer.",
      "pakete": [],
      "durchsetzung": ["Review (pruefer-laie-ux)", "Renders"],
      "ki": false
    },
    {
      "id": "D-07",
      "schluessel": "keine-deko",
      "text": "Ruhig und präzise statt geschmückt: keine Glows, Blobs, Schatten-Stapel, Unschärfe als Schmuck, kein Lila-Verlauf auf allem, keine bunten Kacheln ohne Bedeutung, keine Animation zur Zierde. Glas nur nativ (Seitenleiste und Werkzeugleiste unter macOS 26) oder über `GlassSurface`, das in Renders einen Token-Ersatz zeichnet. Verläufe nur als Token (`Theme.accentGradient`, `Wallpaper`).",
      "pakete": ["gestaltung"],
      "durchsetzung": ["make check-design (Unschärfe)", "Review (pruefer-design)"],
      "ki": false
    },
    {
      "id": "D-08",
      "schluessel": "hell-dunkel",
      "text": "Hell und dunkel sind beide gestaltet. Text erreicht mindestens 4,5:1 auf seinem Grund, Ringe und Bedienelemente 3:1; jede neue Farbe bekommt ihren Kontrasttest in `App/Tests/DesignTests.swift`.",
      "pakete": [],
      "durchsetzung": ["App/Tests/DesignTests.swift", "make shots"],
      "ki": false
    },
    {
      "id": "D-09",
      "schluessel": "bewegung",
      "text": "Bewegung nur über die Federn aus `Motion`, und nur dort, wo sie einen Zustandswechsel erklärt. Reduce Motion wird beachtet (`Motion.adaptive`, Überblendung statt Bewegung); Endlos-Animationen nur für Arbeitszustände (Spinner, Pegel).",
      "pakete": ["gestaltung"],
      "durchsetzung": ["make check-design", "Review"],
      "ki": false
    },
    {
      "id": "D-10",
      "schluessel": "deutsch-passt",
      "text": "Deutsche Texte sind etwa 30 % länger und passen trotzdem: keine festen Breiten für Text, kein Abschneiden, keine Silbentrennung mitten im Wort, kein harter Umbruch mitten im Satz, weder in UI-Texten noch in Absätzen der Doku. Geprüft wird in den Renders mit `de`.",
      "pakete": ["layout"],
      "durchsetzung": ["make check-texts (harte Umbrüche)", "make shots (de)", "Review (pruefer-laie-ux)"],
      "ki": false
    },
    {
      "id": "D-11",
      "schluessel": "zustaende",
      "text": "Jeder Bereich mit Daten hat gestaltete Zustände: leer (`EmptyState` mit Titel, einem Satz und höchstens einer Aktion), beschäftigt (`Spinner`, `ProgressRow`), Fehler (`InlineNotice`: was fehlt und was daraus folgt). Ein optionaler Abschnitt ohne Inhalt entfällt samt Überschrift.",
      "pakete": [],
      "durchsetzung": ["Galerie", "Renders", "Review"],
      "ki": false
    },
    {
      "id": "D-12",
      "schluessel": "barrierefreiheit",
      "text": "Alles ist mit der Tastatur erreichbar (Fokus sichtbar, `↑` und `↓` in Listen, `Esc`, `⌘W`, `⌘,`), Bedienelemente haben Namen für VoiceOver, Trefferflächen sind mindestens 24 pt groß, Zeilen 44 pt.",
      "pakete": [],
      "durchsetzung": ["Review (pruefer-laie-ux)"],
      "ki": false
    },
    {
      "id": "D-13",
      "schluessel": "renders",
      "text": "Jeder sichtbare Zustand hat eine `RenderScene` (Kennung `<bereich>.<zustand>`). Vor „fertig“ werden alle betroffenen Szenen in en und de, hell und dunkel gerendert (`make shots ONLY=<präfix>`) und jedes PNG angesehen; die angesehenen Bilder stehen in der Statusdatei. Ohne Bilder lautet das Ergebnis der Sichtprüfung „nicht geprüft“.",
      "pakete": [],
      "durchsetzung": ["make shots", "Review (pruefer-laie-ux, pruefer-design)"],
      "ki": false
    },
    {
      "id": "D-14",
      "schluessel": "app-formen",
      "text": "Fenster entstehen über `WindowHost`, die Aktivierungsrichtlinie regelt `AppForm`: `.regular` mit Modul `window`, sonst `.accessory`, Einstellungen und Onboarding schalten vorübergehend um. Die Insel misst den Bildschirm (Notch, Menüleistenhöhe) und legt nichts fest; Panels der Menüleiste sind 320 bis 360 pt breit.",
      "pakete": [],
      "durchsetzung": ["Review (pruefer-integration)"],
      "ki": false
    }
  ]
}
